{"source_tif":"/home/lachlan/ProjectsLFS/Zhengyu/DEO/App80 DEO/10uM/05-十二月-2025/10x01.tif","source_png":"/home/lachlan/ProjectsLFS/Zhengyu/DEO-PNG/App80 DEO/10uM/05-十二月-2025/10x01.png","image_level":{"droplet_count_clear":1,"droplet_count_including_partials":3,"analyst_note":"One dominant central droplet is clearly analyzable. Two edge partial droplets are present (top-right and bottom-right), but the bottom-right segment contains minimal interpretable internal material, so its biological estimates are low-confidence."},"droplets":[{"droplet_id":1,"organoid_count_estimated":52,"fusion_level_0_to_5":4,"quant_note":"Central full droplet with dense mixed organoid/clump content and multiple coalesced regions; strong fusion is evident in major internal aggregates.","confidence":0.95},{"droplet_id":2,"organoid_count_estimated":4,"fusion_level_0_to_5":3,"quant_note":"Top-right partial droplet shows a small but distinct cluster with moderate local coalescence; limited field coverage constrains counting precision.","confidence":0.74},{"droplet_id":3,"organoid_count_estimated":1,"fusion_level_0_to_5":1,"quant_note":"Bottom-right edge droplet arc is mostly out of frame with little clear internal structure visible; estimate is conservative and highly uncertain.","confidence":0.36}]}