{"source_tif":"/home/lachlan/ProjectsLFS/Zhengyu/DEO/App80 DEO/10uM/05-十二月-2025/10x02.tif","source_png":"/home/lachlan/ProjectsLFS/Zhengyu/DEO-PNG/App80 DEO/10uM/05-十二月-2025/10x02.png","image_level":{"droplet_count_clear":0,"droplet_count_including_partials":2,"analyst_note":"One dominant partial droplet fills most of the frame with heavy internal aggregate content; one additional small partial droplet is visible at the far right edge near the top-right area."},"droplets":[{"droplet_id":1,"organoid_count_estimated":33,"fusion_level_0_to_5":4.3,"quant_note":"Large clipped droplet with numerous organoid-like bodies and multiple dense coalesced clusters, especially upper and lower-central regions, indicating strong fusion.","confidence":0.86},{"droplet_id":2,"organoid_count_estimated":1,"fusion_level_0_to_5":0.8,"quant_note":"Small edge partial droplet segment; appears to contain a single dominant organoid-like body with minimal evidence of fusion.","confidence":0.66}]}