{"source_tif":"/home/lachlan/ProjectsLFS/Zhengyu/DEO/App80 DEO/10uM/05-十二月-2025/4x00.tif","source_png":"/home/lachlan/ProjectsLFS/Zhengyu/DEO-PNG/App80 DEO/10uM/05-十二月-2025/4x00.png","image_level":{"droplet_count_clear":5,"droplet_count_including_partials":9,"analyst_note":"Baseline droplet set is retained. Five fully visible droplets are quantifiable with higher confidence; four edge droplets are partial and were kept with reduced confidence and generally lower organoid burden than the initial baseline for the smallest edge segments."},"droplets":[{"droplet_id":1,"organoid_count_estimated":18,"fusion_level_0_to_5":4,"quant_note":"Top-edge partial droplet with multiple dark aggregates and clear local coalescence.","confidence":0.88},{"droplet_id":2,"organoid_count_estimated":46,"fusion_level_0_to_5":5,"quant_note":"Very dense droplet with extensive merged dark mass; strongest fusion in field.","confidence":0.97},{"droplet_id":3,"organoid_count_estimated":31,"fusion_level_0_to_5":4,"quant_note":"Central droplet with several medium-large clusters and notable fused regions.","confidence":0.95},{"droplet_id":4,"organoid_count_estimated":24,"fusion_level_0_to_5":3.5,"quant_note":"Bottom-center droplet with mixed singles and clustered organoids; moderate fusion.","confidence":0.93},{"droplet_id":5,"organoid_count_estimated":29,"fusion_level_0_to_5":4,"quant_note":"Bottom-right droplet with multiple dense nodules and strong local fusion.","confidence":0.94},{"droplet_id":6,"organoid_count_estimated":5,"fusion_level_0_to_5":1,"quant_note":"Bottom-left droplet is sparse, mostly particulate background with few small bodies.","confidence":0.86},{"droplet_id":7,"organoid_count_estimated":2,"fusion_level_0_to_5":0.5,"quant_note":"Left-edge partial arc shows minimal interpretable organoid material.","confidence":0.55},{"droplet_id":8,"organoid_count_estimated":1,"fusion_level_0_to_5":0,"quant_note":"Small right-edge partial with near-empty interior and rare tiny particle-like bodies.","confidence":0.5},{"droplet_id":9,"organoid_count_estimated":4,"fusion_level_0_to_5":1,"quant_note":"Lower-right edge partial with low-density small clusters and weak coalescence.","confidence":0.68}]}