{"source_tif":"/home/lachlan/ProjectsLFS/Zhengyu/DEO/App80 DEO/10uM/05-十二月-2025/10x00.tif","source_png":"/home/lachlan/ProjectsLFS/Zhengyu/DEO-PNG/App80 DEO/10uM/05-十二月-2025/10x00.png","image_level":{"droplet_count_clear":1,"droplet_count_including_partials":1,"analyst_note":"One dominant circular droplet is fully visible and centered; no additional partial droplets are evident at the image boundaries. Internal content shows extensive aggregation with many small spheroid-like bodies."},"droplets":[{"droplet_id":1,"organoid_count_estimated":105,"fusion_level_0_to_5":4.4,"quant_note":"Large fused masses are present in the upper-central and lower-central regions, with multiple clustered aggregates on the right side and numerous smaller spheroid-like structures throughout the droplet. Estimate is visual and excludes obvious non-organoid background artifacts where possible.","confidence":0.84}]}