{"source_tif":"/home/lachlan/ProjectsLFS/Zhengyu/DEO/App80 DEO/10uM/05-十二月-2025/4x02.tif","source_png":"/home/lachlan/ProjectsLFS/Zhengyu/DEO-PNG/App80 DEO/10uM/05-十二月-2025/4x02.png","image_level":{"droplet_count_clear":2,"droplet_count_including_partials":2,"analyst_note":"Two clearly bounded, analyzable droplets are present (mid-left and mid-right). No additional edge-partial droplet is confidently visible."},"droplets":[{"droplet_id":1,"organoid_count_estimated":78,"fusion_level_0_to_5":3.6,"quant_note":"Left droplet shows multiple dark coalesced clusters with many smaller surrounding bodies; fusion appears moderate-to-strong in several local regions.","confidence":0.9},{"droplet_id":2,"organoid_count_estimated":88,"fusion_level_0_to_5":3.2,"quant_note":"Right droplet has a dense interior with one dominant central fused aggregate plus many smaller bodies; overall moderate fusion with one notable strong focus.","confidence":0.91}]}