{"source_tif":"/home/lachlan/ProjectsLFS/Zhengyu/DEO/App80 DEO/10uM/05-十二月-2025/4x01.tif","source_png":"/home/lachlan/ProjectsLFS/Zhengyu/DEO-PNG/App80 DEO/10uM/05-十二月-2025/4x01.png","image_level":{"droplet_count_clear":3,"droplet_count_including_partials":5,"analyst_note":"Three droplets are fully visible and quantifiable (mid-left, mid-right, bottom-center), with two additional edge-partial droplets (top-right and top-left). Internal content ranges from dense fused aggregates to sparse particulate structures; a thin fiber/debris artifact is present near the top-right partial droplet."},"droplets":[{"droplet_id":1,"organoid_count_estimated":62,"fusion_level_0_to_5":4.4,"quant_note":"High-density droplet with multiple large dark coalesced aggregates and many smaller surrounding bodies; strong fusion phenotype.","confidence":0.94},{"droplet_id":2,"organoid_count_estimated":42,"fusion_level_0_to_5":2.9,"quant_note":"Moderate droplet load with dispersed small structures and fewer compact fused masses than droplet 1.","confidence":0.88},{"droplet_id":3,"organoid_count_estimated":54,"fusion_level_0_to_5":3.7,"quant_note":"Mixed field of small organoids with several darker merged clusters, including one prominent dense aggregate; moderate-strong fusion.","confidence":0.9},{"droplet_id":4,"organoid_count_estimated":38,"fusion_level_0_to_5":3.6,"quant_note":"Partial droplet with only lower interior visible; notable central dense clump plus scattered satellites indicates moderate-strong local fusion.","confidence":0.75},{"droplet_id":5,"organoid_count_estimated":4,"fusion_level_0_to_5":0.8,"quant_note":"Very small edge partial with minimal visible interior content; only a few faint structures observed, low confidence estimate.","confidence":0.36}]}